Date,Comment,Quality,Difficulty,Tags,Course,For Credit,Attendance,Grade,Textbook,Thumbs Up,Thumbs Down
2014-10-25,I found his class very interesting. You have to study about the topic. No tricky question tests. Highly recommended.,5.0,1.0,,EEL4789,True,,,3,0,0
2013-07-16,"I took the undergraduate parallel course before, so I had prior knowledge. I found his class extremely informative but what makes the difference is that he is passionate about the subject. There were no tricky questions, per-say, on his test but there were questions that you could easily make mistakes. Do the HW and you will have no problems.",5.0,2.0,,EEL5996,False,,,5,0,0
2008-12-08,"Business Intelligence class. Great professor. VERY knowledgable and very passionate about the subject matter. wants you to learn beyond the 'textbook material', which is good but sometimes makes assignments too vague and open-ended",4.0,2.0,,CIS613,False,,,2,0,0
2008-04-24,"Prof. Pons was the BEST professor I ever had while taking graduate classes at UM. He is extremely knowledgeable in his field and is a very good instructor, he explains things in detail and gives real life examples for applications he teaches. I can't say enough about him as a professor. I wish he would teach more classes at UM.",5.0,5.0,,CIS523,False,,,4,0,0
2006-12-11,"OK, Hes not like any of the ratings listed here. Very nice guy. Yes the class is extremely intensive. Tons of homework, a HUGE semester project and 3 exams. However it is not impossible. If I can get an A in the class Im sure other people can. You must dedicate your time. If you can, take it on a semester with a lighter load. He gives EC",4.0,1.0,,CIS523,False,,,4,0,0
2006-04-20,"This instructor is very insecure around male students and makes inappropriate comments about all students. How is this guy a teacher&#63; He is unprepared, unprofessional, and rude. After he insults people he stops them from reporting him by offering good grades.",1.0,4.0,,PROGRAMMING,False,,,,0,0
2005-12-19,This instructor is so boring! I had to take the class because it is a requirement for my degree. He talks a lot but does not teach. I honest can say this is the worst college instructor I have ever had.,1.0,3.0,,PROGRAMMING,False,,,,0,0
2005-07-07,This professor is not knowledgeable of the subject matter and he reads directly from note provided by the publisher of the book for the course.All of the class materials and lectures ans not reflected in the exam. The professor is extremely boring and his lack of knowledge makes you feel sorry for him. Do not waste you time and money.,1.0,5.0,,CIS523,False,,,,0,0
2005-07-05,No Comments,1.0,5.0,,CIS523,False,,,,0,0
