Date,Comment,Quality,Difficulty,Tags,Course,For Credit,Attendance,Grade,Textbook,Thumbs Up,Thumbs Down
2022-12-14,"prof is really interested in the material. He is just very strict and has very specific rules that if you don't follow he makes a fool out of you. His class is definitely the hardest BTE210 class compared to the other classes. We had to do case studies (3+ hours a day) when other classes just had to present simple power points like ""what is apple.""",2.0,5.0,"Group projects, Lots of homework, Lecture heavy",BTE210,True,mandatory,A,-1,0,0
2022-12-12,"Honestly, all the reviews on here are a bit of an exaggeration. For the team projects and presentations: as long as you know what you're presenting and you're not reading off of the slide, he won't criticize you. I wont lie, though, this class was hard and time consuming, but not the worse thing on earth. ",4.0,5.0,"Tough grader, Group projects, Clear grading criteria",BTE210,True,mandatory,B+,-1,0,0
2022-12-09,He's honestly not bad as all these reviews are making him out to seem. I actually liked him. Group projects are time consuming but if you follow his framework and listen to his preferences you will do fine. Definitely not an easy A. But a B is not too difficult to get. Make sure u dont forget to put the attendance code when you get to class. ,3.0,4.0,"Group projects, Gives good feedback, Lecture heavy",BTE210,True,mandatory,Not sure yet,-1,0,0
2022-11-11,"He is a tough teacher, but if you work hard and get on his good side- you're good.",3.0,5.0,"Tough grader, Participation matters, Group projects",BTE210,True,mandatory,A,-1,0,0
2022-11-10,"Prof K is tough. He can be very blunt and mean. On the other hand, you might get lucky, and he will respect you. It really is a gamble. Take another professor if you can. The case studies aren't that bad. It is really just him that is bad. But as a person, he does seem to care, just expresses this is an odd way.",2.0,5.0,"Tough grader, Group projects, Accessible outside class",BTE210,True,mandatory,Not sure yet,-1,0,0
2022-11-08,"Professor Korogodsky is tough but super fair. As long as you put in the work and pay attention you can manage a B with no issues. He is eager to teach and answer questions as long as you are eager to learn. His tests were a little bit difficult, but his projects are fun.",5.0,3.0,"Tough grader, Group projects",BTE210,True,mandatory,A-,-1,0,1
2022-11-01,"Whatever good ratings on here for him are fake ones written by him. Dude sucks, avoid",1.0,3.0,"Lecture heavy, Graded by few things",BTE210,True,mandatory,A,-1,0,0
2022-10-25,"Very mean and intimidating. You do 2 cases that he grades harshly, 2 exams and a final project. No point in trying to talk to him he'll just say to come during office hours. He will either not be there or be very dismissive when you arrive. Does not want you to succeed. Take someone else ",1.0,4.0,"Tough grader, Group projects",BTE210,True,mandatory,,-1,0,0
2022-09-29,BTE is required so there's almost no way around him but if you can take another teacher. Gives group cases that have nothing to do with class and grades them hard. He almost wants to fail some students. The course material is boring and korogodsky doesn't help. He is usually just making everyone feel awkward when he calls people out in class. ,1.0,4.0,"Tough grader, Group projects, Test heavy",BTE210,True,mandatory,,-1,0,0
2022-09-26,Very bad professor. Loves the tiny bit of power that has and is very disrespectful towards students. Impossible to talk to and if you try to approach him he will essentially tell you to kick rocks. Also gives impossibly hard group presentations that he will interrupt you during to nit pick. Do not take him if you have the option.,1.0,5.0,"Tough grader, Group projects",BTE210,True,mandatory,,3,1,0
2022-09-26,This individual should be relived of their profession in any future academic setting. ,1.0,4.0,,BTE210,True,mandatory,C,-1,0,0
2022-09-26,Doesn't care if you succeed. ,1.0,4.0,,BTE210,True,mandatory,C,-1,0,0
2022-09-22,"Worst teacher I've ever had, hands down. The dude is just plain rude to students and doesn't seem to actually care at all about teaching the class. UM should be ashamed of themselves for offering this fool employment. He belongs in a kindergarten classroom (as a student) because all he does is act like a child.",1.0,1.0,Lecture heavy,BTE210,True,mandatory,A,-1,0,0
2022-08-21,"Prof Korogodsky is straight-up mean. He constantly nit-picks every part of your group projects, will ask you questions in the middle of your presentation and will make you sit down mid-presentation if he doesn't like your answer. Don't bother trying to get away with someone signing you in cause he'll catch you.",1.0,4.0,"Tough grader, Group projects, Graded by few things",BTE210,True,mandatory,B,-1,0,0
2022-05-20,"Professor K, is a nice guy, the class material is not hard at all, tests are memorization heavy but everything can be found on the slides. He is tough with the presentations and group projects, get a good team and prepare well, tests are super easy! All multiple choice.. I would choose another Professor but if youre stuck with him its not bad",4.0,5.0,"Tough grader, Group projects, Gives good feedback",BTE210,True,Y,,0,0,0
2022-05-19,"Usually, I say to take these ratings with a grain of salt, but every rating of this professor is absolutely accurate and true. I did end his class with an A, but that was definitely not expected and it was not without borderline trauma. He belittles students, and worse than that, I genuinely don't think I learned anything valuable from his class.",1.0,4.0,"Tough grader, Group projects, Lots of homework",BTE210,True,mandatory,A-,-1,0,0
2022-05-18,"Comes off as rude but is funny and nice if you get to know him. Despite kind of liking him as a person, trust me, DON'T take his class. Mostly group work. BY FAR hardest class I have ever taken in my life. Was an A student w/ 4.0 gpa but got a B. It was so hard and I expected to do even worse. Devoted most of my time to his class. Avoid it. ",2.0,5.0,"Tough grader, Group projects",BTE210,True,mandatory,B,-1,0,0
2022-04-29,"he loves to belittle students. sometimes he has a funny side, but 99% of the times I felt miserable and terrified of him. his group projects have unrealistic expectations, he is never satisfied with anything you present or do. there was not a single person in the class who met up to his standards.",1.0,5.0,"Tough grader, Group projects, Graded by few things",BTE210,True,mandatory,Not sure yet,-1,0,0
2022-04-13,He does not care about his students at all. He will belittle you in front of your peers till you feel worthless. All he cares about is yelling at you for no reason. Sad how so many of the professors in the business tech department are horrible. Anything you say in his class will not be right as long as he teaches. ,1.0,5.0,"Participation matters, Group projects, Lecture heavy",BTE210,True,mandatory,Drop/Withdrawal,-1,0,0
2022-04-11,first group presentation is graded very heavily. Expects you to know every little detail when presenting ur slide. I suggest sharing ur presentation twice before ur date. Strict with attendance if everyone starts sharing the code. A lot of people dislike him because he likes to criticize people's presentations. I don't suggest taking his class ,2.0,5.0,"Tough grader, Group projects",BTE210,True,mandatory,Not sure yet,-1,0,0
2022-04-04,AVOID AT ALL COSTS. The worst professor I had at UM. Extremely disrespectful towards students and loves to embarrass people during their presentations in front of the class. Gives way more work than the other professors.,1.0,4.0,"Tough grader, Group projects, Lecture heavy",BTE210,True,mandatory,B,-1,0,0
2022-03-24,This professor has such unrealistic standards for his students. The group projects have nothing to do with the class they are just to help with his ego. Avoid taking him.,1.0,5.0,"Tough grader, Group projects, Graded by few things",BTE210,True,mandatory,Not sure yet,-1,0,0
2022-03-01,"This professor is a very smart and well-educated person.  However, he creates unrealistic expectations for students when it comes to group projects and exams.  He also discourages students giving any input or questioning his methods.  I would definitely avoid this professor at all costs.",1.0,4.0,"Tough grader, Lecture heavy, Graded by few things",BTE210,True,mandatory,B,-1,2,0
2022-02-24,Lots of long lectures and very harsh grader. Very difficult to communicate and work with. Would not recommend,1.0,4.0,,BTE210,True,mandatory,,0,1,0
2022-02-11,"Awful, too critical is fake nice to the students and is just rude plain and simple rude undoubtedly gets off on the little power he has, grades hard too worst of both worlds",1.0,5.0,,BTE210,True,mandatory,Not sure yet,0,1,0
2022-02-10,Rude. Dumb. Bald. Worst prof at miami,1.0,4.0,"Skip class? You won't pass., Lecture heavy, Tough grader",BTE210,True,mandatory,,0,1,0
2021-12-14,"If you want to learn and/or get a good grade, avoid this professor. He teaches to boost his own ego, not to help students learn. The course material isn't hard by any means, yet it's quite hard to get a good grade on anything. He wants to teach the class that nobody does well in, evidenced by exams graded largely on semantics not understanding.",1.0,3.0,"Lecture heavy, Tough grader",BTE210,True,mandatory,,0,2,0
2021-11-09,"Prof Korogodsky is overall a nice guy, but I would never recommend taking his classes. His lectures are all over the place, with random information that is just never talked about again or tested on. He clearly knows his IT stuff well, but as a teacher, I received absolutely no benefit from taking his class and only continued to struggle.",2.0,3.0,Group projects,BTE210,True,mandatory,,0,2,0
