Date,Comment,Quality,Difficulty,Tags,Course,For Credit,Attendance,Grade,Textbook,Thumbs Up,Thumbs Down
2026-04-30,"Honestly he came off as intimidating at first, but he quickly softened up. He's actually a nice guy and you could tell he's very passionate about the material and knows what he's talking about. Assignments were quick and the labs were easy to follow along. Him and the TA were very kind and helpful. However, beware he does call on people. ",5.0,2.0,"Gives good feedback, Online Savvy",ECE112,True,non mandatory,A,-1,0,0
2025-12-06,"Excellent professor, but be ready to work. His classes go deep and you learn skills that last. Many who struggle never ask for help, but he's extremely willing if you do. He puts real effort into the course, and if you show interest and work hard, he's one of the best at UM.",5.0,3.0,Gives good feedback,ECE417,True,mandatory,A+,3,0,0
2025-11-24,"Yeah this guy has the most condescending tone as a professor. Very harsh grader and will not accept any late submissions even if you went to the hospital for a kidney stone, which makes no sense since the TA is the one that grades the HW and Labs. Also likes to nitpick on trivial stuff alot. ",1.0,4.0,Tough grader,ECE417,True,non mandatory,Not sure yet,3,0,0
2024-12-06,This professor is not easy. He is not overly difficult either. I took processors with him and it was a difficult concept that he broke down into very understandable chunks. He used the textbook and went off it when necessary. His grading policy is clear and his teaching slides/lectures are helpful. Not one for humor though. ,5.0,4.0,"Clear grading criteria, Beware of pop quizzes, Lecture heavy",ECE212,True,non mandatory,B+,3,0,0
2022-11-10,"Genuinely among the best professors in the Engineering school.
Authentically cares that his students get something out of the class and holds himself to a standard reflecting as much.
He's also truly a good teacher, which helps.
The workload is reasonable enough, and he's willing to work with the class if they disagree.",5.0,3.0,"Gives good feedback, Inspirational, Caring",ECE212,True,non mandatory,Not sure yet,-1,1,0
2022-09-14,He always asked me to shut up when I asked questions. But he helped me find myself when I got lost in assembly language.,5.0,5.0,,ECE212,True,Y,,0,0,0
2020-10-10,"Was my least favorite prof before asking for help. The subject matter is difficult. After reaching out he has done everything in his power to help me and I could tell genuinely wanted me to succeed, even tho I was rude to him in prior classes. Baseline the class is very HARD but if you need help ASK for it. Show him you care and you will do well!",5.0,5.0,"Gives good feedback, Skip class? You won't pass., Group projects",ECE417,True,non mandatory,B+,5,0,0
2020-05-08,"Creates tests that even honor students find difficult, tests always averaging about 70 something for whole class, curves at the end. Unnecessary research paper for course, claiming &quot;writing requirement from the university&quot; when there is no mention of the requirement anywhere on canelink. Will not accept late homework, even if it had a valid reason.",1.0,4.0,"Lots of homework, So many papers, Tough grader",ECE212,True,mandatory,,5,1,0
2019-11-18,"When I say &quot;hilarious,&quot; I mean hilariously bad. We spent 3 weeks on a 1 week lab all because he sent us bad files, and he insisted he sent good files until he tried to do the lab himself and failed. We had 3 homeworks for the first 13 weeks of class, and then he assigned 3 more for the last 2 weeks of class (probably forgot to assign them earlier).",1.0,5.0,Hilarious,ECE417,True,non mandatory,Not sure yet,5,1,0
2019-11-18,"Sets you up for failure, he will deduct points from everything just because he feels like it and when asked why he would just say &quot;thats the grade you got&quot; with out even explaining why you're wrong. BEWARE. you MUST learn everything on your own and waste precious study time sitting in has class watching him struggle to solve his own problems",1.0,5.0,"Test heavy, Beware of pop quizzes, Tough grader",ECE212,True,mandatory,,5,1,0
2019-11-18,"TA is as confused as we are about how to complete the labs. It's 'easy! took me 15 minutes!', comes here after we fail to figure anything out in 3 lab sessions and fails to achieve anything himself. Suddenly it takes him 5 days to do it. Routinely late to class, uploading assignments, and sending labs to TA, yet will screw you if you are late",1.0,5.0,"Beware of pop quizzes, Tough grader",ECE417,True,mandatory,Not sure yet,5,1,0
2019-11-18,"Reads off the power points provided by book publisher, says 'it's not within the scope of this course' whenever you ask ANY questions. Gets lost in explanations of problems, says figure it out. When he posts homework answers, everyone is confused as to how we were expected to understand what he wanted from the questions. For tests memorize the ppts",1.0,5.0,"Beware of pop quizzes, Tough grader",ECE312,True,mandatory,A-,5,1,0
2019-11-18,"Assembly was taught in this class, but it was not taught well. Many of my classmates and I agree that we didn't learn anything. The professor struggled to explain concepts further when students had questions that he couldn't simply answer by reading from the slides. Answer key was wrong for a midterm question. Passed, but felt like I didn't learn.",1.0,3.0,,ECE312,True,non mandatory,A,5,1,0
2019-11-18,"Doesn't explain things well. I didn't learn much in lectures, and had to learn everything through reading the textbook.",1.0,3.0,,ECE201,True,non mandatory,A,5,1,0
2019-09-20,"One of the best professors Ive had, really cares about the learning experience and provides helpful videos that show you how to do the problems. He is very reasonable and the class is hard but he will prepare you for the tests. He also offers extra credit opportunities.",5.0,4.0,"Accessible outside class, Clear grading criteria, Caring",ECE201,True,non mandatory,A,5,0,1
2017-06-02,"If you want to learn assembly code, take his class.",5.0,2.0,"Inspirational, EXTRA CREDIT",ECE312,True,non mandatory,,5,3,4
2017-05-18,"he only has pop quizzes, they follow his presentations, but you need to review all the slides. he is very accessible and flexible.",3.0,3.0,"Participation matters, BEWARE OF POP QUIZZES, ACCESSIBLE OUTSIDE CLASS",ECE112,True,mandatory,B+,0,3,1
2017-05-17,"A lot of homework and quizzes (lowest 2 dropped). He asks you to read sections of the chapters before the lecture. In class, the quizzes are simple and based on what you read, and they count for attendance. You will solve problems in groups and he walks around answering questions. If you like that style of teaching, you will do really well.",4.0,3.0,"LOTS OF HOMEWORK, EXTRA CREDIT, GROUP PROJECTS",ECE201,True,mandatory,,5,7,1
2017-05-17,"If nothing else, you will learn how to properly format an IEEE paper in this course!",5.0,2.0,"Gives good feedback, Amazing lectures",ECE312,True,non mandatory,,5,0,1
2017-05-16,The labs are easy and if you do them you will nail the programming questions on the exams. He gives quizzes as extra credit to the exams. If you write a good paper he will encourage you to pursue an experiment and some really good feedback.,5.0,3.0,"Gives good feedback, Inspirational, EXTRA CREDIT",ECE312,True,non mandatory,A+,5,3,1
2017-05-16,"He relies heavily on the textbook. If you read the textbook with a microscope and do all of the example exercises back and forth (and 20 times over in your sleep), you'll get an A. His finals are extremely difficult and completely comprehensive. Make sure you read even the corners of the textbook that are in 10pt font.",1.0,4.0,"Tough Grader, Get ready to read, TEST HEAVY",EEN312,True,non mandatory,,5,3,0
2017-05-12,The class was fun.,4.0,3.0,"Caring, EXTRA CREDIT, LECTURE HEAVY",ECE312CE312,True,non mandatory,,5,0,1
2017-04-27,Cares if we understood him,4.0,3.0,"Gives good feedback, Respected, EXTRA CREDIT",ECE312,True,non mandatory,A-,5,0,1
2016-12-09,"For homework, he pulls questions from the textbook but makes us submit our answers through blackboard, which gives very little feedback besides which answers were right or wrong. For the final, he basically took the hardest and most missed questions from each exam, made them harder, and included new material he  didn't really cover in class.",1.0,4.0,"Tough Grader, Skip class? You won't pass., BEWARE OF POP QUIZZES",ECE201,True,mandatory,,5,6,0
2016-12-08,One of the worst classes I've taken. He tells students to ask their questions later but then doesn't have time & when we do get to ask them he doesn't understand what we're asking. Very difficult grader-if you get something wrong in pt a) he'll take points off in each subsequent section. Told us we didn't need ch 10 for final but it was 30% ch 10.,1.0,5.0,"Tough Grader, Skip class? You won't pass., BEWARE OF POP QUIZZES",ECE201,True,mandatory,B-,5,6,0
