Date,Comment,Quality,Difficulty,Tags,Course,For Credit,Attendance,Grade,Textbook,Thumbs Up,Thumbs Down
2026-05-30,wait a sem and take it with burt rosenberg ,2.0,5.0,"Get ready to read, Inspirational, Graded by few things",CSC421,True,non mandatory,Audit/No Grade,-1,0,0
2026-01-28,"Murrell should be banned from the ECE department! He doesn't teach. He just throws material at students, expecting them to already know the concepts behind it. IF on the rare occasion that he does give instructions, they are laughably bad. He tends to overcomplicate things to make it harder for students to cheat which just ends of backfiring.",1.0,5.0,,ECE118,True,mandatory,B-,-1,0,0
2026-01-22,This class was all over the place. Grading is very harsh and the assignments were one of the most difficult and hardest parts of the class. The class is split into 50% assignments and 50% exams. The exams were difficult as well. The professor also is a late replier and late grader. You're always on the fence of failing/passing. I do NOT recommend. ,1.0,5.0,Tough grader,ECE318,True,mandatory,F,-1,0,0
2025-12-23,"This course was painfully disorganized. Lectures were unclear, key concepts were skipped, and questions were met with impatience. Grading was excessively harsh and inconsistent, with vague feedback and no clear rubrics. Office hours offered little help. It felt designed to frustrate, not teach. Avoid if you value clarity or fairness. Choose wisely.",1.0,5.0,"Tough grader, Test heavy, Graded by few things",ECE318,True,mandatory,F,-1,1,0
2025-12-18,"This class is 50% assignments and 50% exams. While my assignments were completed on time, most were graded after the semester ended, leaving no opportunity to resubmit them, so I ended up getting a low grade on most. Grading was very harsh. Midterms were reasonable, but the final was significantly harder and very different in style. Be prepared.",1.0,5.0,"Tough grader, Lots of homework, Lecture heavy",ECE318,True,mandatory,Rather not say,-1,1,0
2025-12-03,"Very passionate but not the best lecturer. Course is basically completely self taught through the weekly labs, his exams are basically identical every year/ to practice exams. Grades on labs and exams vary wildly on the TA grading it",3.0,3.0,"Tough grader, Respected, Graded by few things",ECE118,True,mandatory,C-,-1,0,0
2025-08-19,"He is an amazing person, but not a good teacher. He uses different software for every lab, making it confusing how to use it. I spend about 8-10 hours on each lab each week and struggle to get them completed. I wish this course was not required, since I would drop it in a heartbeat. Even still its not too bad",3.0,4.0,"Lots of homework, Lecture heavy",ECE118,True,mandatory,B-,-1,1,0
2025-05-14,"His classes are kind of boring. The labs are very confusing. The exams were different from the practice exams he gave us to study. The only perk about him is that he cares about the material and explains everything in depth, but it's easy to lose focus considering how boring it is.",3.0,4.0,"Lots of homework, Lecture heavy, Test heavy",ECE218,True,mandatory,C-,-1,1,0
2025-05-07,Do yourself a favor and do not take this class. ,1.0,5.0,"Tough grader, Lots of homework, Graded by few things",CSC421,True,mandatory,Not sure yet,-1,1,0
2024-12-30,"Do not underestimate this class. Even if you have coded before, you probably will struggle. The only way to learn from this class is from the labs and ChatGPT. Ask ChatGPT to explain concepts and the code he does in class. On the tests, there's only 3 questions. Focus and only do 2 Q's, save 1 question for the final. It will save you a lot of time.",3.0,5.0,"Graded by few things, Accessible outside class",ECE118,True,mandatory,A,-1,0,0
2024-12-14,"The first two classes I had with him were 118 and 218, which were actually decent. However, after he realized that his whole class was using ChatGPT because of how horrible his lectures were, he decided to hand write everything, and make the assignments + exams unnecessarily difficult. Super unorganized, inconvenient office hours. Be careful.   ",1.0,5.0,Test heavy,ECE318,True,mandatory,B,-1,0,0
2024-12-11,Murrell can have boring lectures at times and you should come prepared with the basics of coding. However he is always willing to answer questions and you WILL learn. The labs are interesting and not too difficult and the tests are challenging but never unfair. Half the class dropped but I believe its more due to lazy students than anything else.,5.0,3.0,Lecture heavy,ECE118,True,non mandatory,A-,-1,1,0
2024-12-06,"I have taken 3 classes with him. I enjoyed the first 2.  After chat gpt, though, he began making assignments and tests more confusing so that using AI would be difficult. This made his assignments and tests very long and confusing. By the end, he was so paranoid about AI cheating he hand wrote our tests and they were almost un-decipherable. ",2.0,5.0,"Tough grader, Test heavy, Graded by few things",ECE318,True,mandatory,B,-1,0,0
2024-08-06,"I think it's helpful to come to this class with a good foundation of coding already. Make sure to pay attention in lectures and ask TAs for help during labs, as they will be one of the best resources.",3.0,4.0,"Lecture heavy, Graded by few things",ECE118,True,mandatory,,-1,0,0
2024-04-30,"He is a very caring teacher if you get to know him, and bends over backwards to meet with students on their availablity. If you dont take advantage of it you will not understand the topics. Test have a great grading structure with the final you only having to do the questions you got wrong on the previous tests nothing more.",5.0,3.0,"Caring, Graded by few things, Accessible outside class",ECE218,True,mandatory,A,-1,0,0
2023-12-15,"He is a very kind professor, but lectures are disorganized and hard to follow, and can be boring. He records all lectures which is very useful. This is a hard class in general, so I think he does a good job despite the overall class not being great. Weekly labs which are hard but important to learn from. Hard work but not too much.",4.0,4.0,Lecture heavy,ECE118,True,mandatory,A,-1,0,0
2023-04-11,Brilliant in his area of expertise but definitely not a great professor. Classes don't really have any structure or follow any topical course outline. Lectures are also painfully boring. Assignments are somewhat difficult but he provides good feedback on them. ,2.0,3.0,,EEN218,True,non mandatory,A-,-1,0,0
2022-09-17,He is like a father to me. I love his hair,5.0,2.0,,ECE318,True,N,,,0,0
2022-09-14,He helped me find myself,5.0,5.0,,ECE318,True,N,,0,0,0
2021-12-18,Murrell is a genius. His tests are fair and the class is generally challenging. His lectures get confusing at times but he is always available in his office if you ever have a doubt. He also has a unique sense of humor and his website is hilarious,5.0,5.0,"Hilarious, Caring, Accessible outside class",EEN218,True,Y,,0,0,0
2020-09-03,Having just graduated ('16-20) I had him for 118 218 318 322 421. If you can listen to messy lectures in class youll learn. I cant &amp; prefer reading a txtbk to followup in classes like this. It still sucks though bcuz he is all over the place w/ his lectures making the txtbk useless. You wont learn but trust me he wont give late grades its an easy A,4.0,2.0,Graded by few things,EEN118218318,True,non mandatory,A+,0,0,0
2019-12-10,"Amazingly brilliant professor! If you are a SWE major, take 1/2/318s with Murrell and you will be well prepared! SM is very caring and genuinely wants his students to do well. Super approachable and unique sense of humor! Strongly recommend!",5.0,2.0,"Respected, Hilarious, Amazing lectures",EEN218,True,non mandatory,Not sure yet,0,0,0
2019-11-30,"Lectures are all over the place ranging from quite helpful to a complete waste of time. He managed time incredibly poorly throughout the semester and tried in vain to make up for it in the end by assigning too much. Really likes the drawing library from 118, but it remains an incredibly poor and finicky tool not well suited for learning algorithms.",1.0,4.0,,ECE318,True,non mandatory,Not sure yet,0,0,0
2017-12-28,"Probably the best professor in UM Engineering, cares deeply about what he teaches and very lenient on late work. I took him for my entire programming sequence and I can't recommend any other professor. His sections are a little tougher than other professors, but if you want to learn there is no better professor.",5.0,4.0,"Respected, LOTS OF HOMEWORK, Tests? Not many",EEN318,True,mandatory,A,0,2,1
2017-12-20,"Dr. Murrell is a true God in programming. You could tell that he just loves what he does. If you are a Software Engineering major, make sure to register for his Intro to C++ because he will give you a great foundation of knowledge for the upper level courses. The tests are difficult - review all previous semester sample tests on Rabbit.",5.0,4.0,"Respected, LOTS OF HOMEWORK, Amazing lectures",ECE118,True,non mandatory,A+,0,2,1
2017-11-27,"Don't take the intro to programming class if you don't already understand coding. Without background knowledge you'll be lost in his class. He moves very fast and the labs are on very different topics than what is covered in class. That being said, he seems like a nice guy.",2.0,4.0,"Tough Grader, GRADED BY FEW THINGS",ECE118,True,non mandatory,,0,7,2
2017-10-16,He is very good professor and he teaches programming at a great pace. He is also a hot tamali.,5.0,3.0,"Gives good feedback, Respected, ACCESSIBLE OUTSIDE CLASS",EEN118,True,mandatory,A+,0,0,3
2017-05-18,He cares about his students and he is always open to help you. lectures and labs are largely unrelated though  When you are taking ECE118 - try to take a lab section on wednesday or thursday - you will most likely thank yourself later. Labs take up A LOT OF TIME - make sure to communicate with lab guys EARLY and stay up on top of your work.,3.0,4.0,"LOTS OF HOMEWORK, SO MANY PAPERS, EXTRA CREDIT",EEN118,True,non mandatory,A-,0,0,0
2017-03-06,"Teaches the class using BCPL, a dinosaur of a language. He deviated from the syllabus and assigned a midterm out of nowhere, when originally we were only going to be graded on coding projects. At the end of the class I will have learned a programming language that does not exist anymore, and concepts that I could have learned on my own. Don't take",1.0,3.0,,CSC421,True,non mandatory,,0,0,3
2017-02-15,Dr. Murrell was the best professor I had at UM.  Strongly recommended.,5.0,4.0,"Respected, ACCESSIBLE OUTSIDE CLASS, Amazing lectures",EEN218,True,,A+,5,0,0
2016-04-18,"He does not really goes over that basics. Extremely difficult to keep up with his lectures, not really help full. When he teaches he just talks with no correlation to a main title. You need to have strong basics to well on his class.",1.0,5.0,,EEN118,True,non mandatory,Drop/Withdrawal,1,2,6
2015-11-18,"Really helpful, but the class is hard and tests are really hard",5.0,4.0,,ECE118,True,non mandatory,,1,1,0
2015-11-10,He is a good person  however is had to follow his lectures. this felt more like an intermediate class than an intro. Recommend having strong basics before taking this class,1.0,2.0,,ECE118,False,non mandatory,,1,4,0
2015-04-15,"awesome professor, the best at UM. I took him for een218 , een318, een322, and now een521(the HARDEST of all) the graders are flexible with the deadlines most of the time. When you are in his class try to listen to every word because they are gold, even more if you are CS or Software Engineering. ",3.0,4.0,,EEN521,True,,,1,5,0
2014-10-01,Excellent teacher.  Will take the time to explain things and always willing to lend a hand.  Very easy going personality.,5.0,3.0,,EEN511,True,non mandatory,A+,2,1,0
2014-08-12,"Hands-down best engineering professor at UM. I have taken him 4 times already, and I owe most of what I've learned about computers to him",5.0,3.0,,EEN118,False,Y,A,5,2,1
2014-07-15,"This was THE HARDEST class I've ever taken at UM. Murrell is extremely smart, but most classes I simply could not keep up with him. He draws complicated diagrams on the board which are hard to understand later on, and the projects are ridiculous. In fact, NO ONE has ever finished the final project. Still, he is willing to help so ask him for it!",3.0,5.0,,EEN521,False,,,1,2,0
2014-05-12,"The best class ever, if you are learning at UM, ECE or CSC, you should take this ! One of the best teacher in the world !",5.0,5.0,,EN521,False,N,,4,1,0
2013-09-05,For sure take him,5.0,3.0,,EEN218,False,,,2,0,0
2013-04-24,"Take him! one of the best professors at UM. Had him for EEN 118 and 218, really happy I took his class",5.0,3.0,,EEN118,False,,,1,1,0
2013-02-28,"Dr. Murrell is one of the two best teachers I've ever had. Seriously, if you can take a class with him, do it. Words cannot communicate how much happier and smarter you will feel after taking any of his C++ classes vs taking it with anyone else.",5.0,3.0,,EEN118,False,,,1,0,0
2012-04-12,"The man has been programming for I don't know how long, but still keeps his enthusiasm about the subject and teaching. Dr. Murrell is the rare instance where the professor is incredibly knowledgeable and also has the gift of instructing others in an efficient manner. Great human being.",5.0,3.0,,EEN218,False,,,2,1,0
2011-12-19,"Great teacher. Funny, and he is genuinely out there to help you. Programming is a naturally boring class but he makes it relatively painless. Labs are actually helpful, problem is if you have a hard week with a lot of tests your going to get behind on them and it will hurt your grade.",3.0,3.0,,EEN118,False,,,1,1,0
2011-11-05,Dr. Murrell is the best teacher I've ever known and one of the smartest people I've ever met. Highly recommend you to learn as much as you can from him.,5.0,3.0,,EEN218,False,,,3,0,0
2009-07-23,"I had him for various programming classes and senior project. He is really smart, he really helped my team get through the senior project whenever we got stuck, rather than just provide general advice. I highly recommend him for Senior Project, he will not abandon you and he'll stay up the entire night before the final presentation helping you.",5.0,3.0,,EEN511,False,,,1,0,0
2009-05-18,the way his finals works makes it easy to pass the class.,4.0,4.0,,EEN218,False,,,1,0,0
2009-05-15,Not a bad professors very nice and helpful but class to me was extremely hard. I had taken programming classes before and things he taught didn?t make any sense. He has his own programming language that was supposed to make it easy but to me made it harder. Also labs had nothing to do with things taught in class.If you are computer engineering you,3.0,5.0,,EEN118,False,,,1,0,0
2009-01-06,Great professor! Explains things very well and does not mind answering questions. However the labs are not explained well in class. I found myself to understand class notes and not understand the labs.,4.0,3.0,,EEN118,False,,,2,0,0
2008-12-16,How many teachers use beer as a learning aid&#63;!,4.0,4.0,,EEN118,False,,,1,0,0
2008-11-17,"Dr. Murrell is a great teacher. He approaches programming in a completely different way. As a beginner you will build a strong base, and if you are already strong in C++,like me, he will still make keep you interested with his fun lectures and questions. His test are fun and easy, and we don't use the textbook. Recommended for all who want to learn",5.0,1.0,,EEN118,False,,,1,0,0
2008-01-27,"He is one of the best programming professors at UM. he will challenge you with his weekly labs. the labs are kind of hard for beginners, but you will learn how to program at the end. I will recommend him to any one who wants to learn programming, but you will not get an easy A in this class, but you have to earn it.",4.0,5.0,,EEN118,False,,,4,0,1
2007-11-16,"excellent methods, challenges you to think. i HATED programming before him but he managed to interest me. funny guy as well if you catch his subtlties",5.0,3.0,,EEN118,False,,,1,0,0
2007-10-27,He is the reason why I enjoyed college. He really cares about students and loves teaching. Also one of the smartest people I have ever met. Sometimes he doesn't stick to curriculum but what he teaches is extremely valuable. Going to one of his upper level classes is like listening to a story. He keeps your attention and still makes sure you learn.,4.0,4.0,,EEN511,False,,,2,0,0
2007-07-24,"The best programming teacher at UM.  If you really want to learn your stuff, start with him from the beginning, even if it takes having to delay starting programming classes for a semester.",5.0,5.0,,EEN318,False,,,2,0,0
2007-05-21,Dr. Murrell is awesome,5.0,4.0,,EEN521,False,,,1,0,0
2007-04-24,doesnt teach just shows you various programs & expects you to understand and be a whiz at it.  doesnt explain things well to beginners.,1.0,5.0,,EEN118,False,,,1,1,0
2006-05-04,"Best programming teacher ever. Learned a lot and got a job at Microsoft becuase of what I learned from him. Definately not the easiest teacher, but he will chalenge you to develop your skills and is always willing to help out.",5.0,3.0,,EEN118218318,False,,,,0,0
2005-12-02,"if you want an easy, simple route to learning c++ programming, take helmers. If you want to learn a bit harder, yet much more interesting stuff, take murrell. Murrell is a genius, but if you dont get on his wavelength, you can really struggle. If you get it though, you learn a LOT and some really cool stuff",5.0,4.0,,EEN118,False,,,,0,0
2005-11-07,"I found him great. He's the reason I got a Ph.D. and got into teaching myself. Very knowledgable, challenges you to think. Will not just provide answers, expects you to be creative but is not unreasonable. Project-oriented assignments, a lot of work but I learned and built confidence. If you're self-motivated you can get a lot out of his style.",5.0,4.0,,SEVERALINCS,False,,,,0,0
2005-10-22,"Because of him, Kabuka and Helmers, I transferred to Computer Engineering.",5.0,2.0,,EEN,False,,,,0,0
2005-10-13,No Comments,3.0,3.0,,PROGRAMMING,False,,,,0,0
2005-09-03,"cool guy, kinda wierd",4.0,2.0,,PROGRAMMING,False,,,,0,0
2004-06-30,"In the 1st class, i think he's like mr. bean ! But after class you gonna feel like wow ! he's so cool !!",5.0,2.0,,EEN511,False,,,,0,0
2003-07-28,da bomb,5.0,4.0,,EEN218,False,,,,0,0
2003-02-26,"Dr. Murrell is the man, though he smells like cofee.",4.0,3.0,,ENG,False,,,,0,0
2003-02-01,No Comments,5.0,3.0,,EEN511,False,,,,0,0
