Date,Comment,Quality,Difficulty,Tags,Course,For Credit,Attendance,Grade,Textbook,Thumbs Up,Thumbs Down
2008-11-16,Professor teaches as if you have had background for a programming class. Was supposed to be an intro into programming with java. Do not take unless you want a headache every Sunday trying to do the impossible homework. Would not take this class if I had to choose again.,1.0,5.0,,CSC120,False,,,3,5,0
2008-10-30,"OK this class sucks!!! if you are not a computer science major dont even bother taking the class!!! he assumes you know about basic programming, teaching is boring barely explain things, hws are hard, midterm is difficult..you spend tons of time in the hws.. TAs are somewhat helpful... if u need a Math elective.. dont even think of CSC 120!!!",1.0,4.0,,CSC120,False,,,2,2,0
2008-10-28,Professor Milenkovic is a really nice teacher and is fair. However his class is really hard. If you do not have a basic understanding of Java or C++ the class will be difficult. He teaches as if you already know what he is talking about. His instructions are not clear at all. Take his class only if you already have an idea about the subject.,1.0,5.0,,CSC120,False,,,4,2,0
2008-10-01,"Mr. Milenkvic is a good teacher. However, you really need a strong logic background in order to be able to understand what he's talking about in class. I had 6 years of programming language expereicen and was taking the class for fun and it did the job, but he WAS suprisingly fast on lecture, assuming that all the students know alot.",3.0,1.0,,CSC120,False,,,2,2,0
2008-01-12,I had difficulty learning with his teaching style. He basically sits at his laptop and types lines of code in class and explains what hes doing. He draws no pictures on the board to illustrate the data structures concepts behind the code. Visual learners beware. I will avoid this teacher in the future.,3.0,5.0,,CSC220,False,,,3,1,0
2007-07-08,"Milenkovic can get boring but his class is pretty straightforward. It consists of lectures with notes and programs and stuff up on the screen and then quizzes every once in a while, and then theres a couple tests based off of the quizzes and notes.",3.0,3.0,,CSC220,False,,,3,1,1
